id,severity,e2e_observation,harness_current,severity_class,recommended_action,severity_files
B1,AllReduce out of scope,"TP=8 e2e: cross_device_reduce ~35% GPU (M=4096); ~50% at M=1024/2048","Deployment MI300X-DP1-TP1-EP32; no AR in rewardbench/tasksets",critical,"Document as e2e-only bottleneck; track AR separately or add TP>1 smoke; do not expect o_proj campaign to move TTFT alone","../README.md; ../../../testbench/harness/backends/rocm_amd.py; e2e_prefill_op_share.csv"
B2,MLA path name mismatch,"Prefill uses dense aiter mla_dec_stage1 (mla_decode_fwd); sparse flash/unified MLA absent","Campaign dsa_attn baseline oriented to sparse @ S=65536 (pa_decode_sparse)",critical,"Split harness cases: dense_prefill_stage1 vs sparse_decode_S64k; retarget dsa_prefill_attn baseline to stage1 for short-prefill e2e","../amd-glm-object.csv; ../operator_mapping.md; ../../../testbench/tasks/glm52/dsa_prefill_attn/"
B3,FP8 GEMM baseline too soft,"E2E already on ASM/CK bpreshuffle (fp8gemm BpreShuffle + CK); fp8_fast_path installed","amd_glm5_aiter_baseline / object CSV often Triton or plain gemm_a8w8_blockscale; notes ASM sometimes unbuildable",high,"Re-measure aiter baseline with bpreshuffle_asm/ck; stop quoting 2x vs Triton as production headroom","../amd_glm5_aiter_baseline.csv; ../amd-glm-object.csv; ../operator_mapping.md; /root/glm5-flops-amd/fp8_fast_path.py"
B4,MoE under-prioritized,"fused_moe_kernel #2 at ~16% GPU","moe_total in taskset/official metrics but NOT in 3-op campaign TARGETS",high,"Promote moe_total_prefill into campaign primary or second tier","../../../tasksets/glm52_rocm_local.json; ../emit_targets.py; ../../../testbench/tasks/glm52/moe_total_prefill/"
B5,o_proj/index_k vs e2e share,"o_proj/index_k folded into FP8 GEMM aggregate ~11%; not top-1","Campaign primary: o_proj + index_k (layer share >5% microbench)",medium,"Keep as kernel contests but annotate limited e2e TTFT leverage under TP=8","../amd-glm-object.csv; ../emit_targets.py"
B6,KV context assumption,"max_total_tokens=65536 pool but actual seq=input_len; short dense prefill","Microbench S=65536 attend for attn/indexer",medium,"Add short-S prefill shapes matching e2e; keep S=64k as longctx suite","../../../tasksets/glm52_rocm_local.json; glm52_ops DEFAULT_SWEEP"
B7,Elementwise/misc noise,"ATen elementwise/misc ~14% at M=4096","Not modeled as harness op",low,"Ignore for campaign; investigate only if AR/MoE/MLA fixed","e2e_prefill_op_share.csv"
